<?xml version="1.0" encoding="UTF-8"?>
<dataroot xmlns:od="urn:schemas-microsoft-com:officedata" xmlns:xsi="http://www.w3.org/2001/XMLSchema-instance"  xsi:noNamespaceSchemaLocation="Monster.xsd" generated="2017-04-24T11:22:20">
<Monster>
<ID>1</ID>
<GivenID>1</GivenID>
<MonsterName>스켈레톤</MonsterName>
<Desc>뼈해골</Desc>
<Damage>1</Damage>
<Life>10</Life>
<MagicPower>1</MagicPower>
<HungryPointPerTurn>0</HungryPointPerTurn>
<ExpForEvolution>100</ExpForEvolution>
<PassiveID>-1</PassiveID>
<Virtue>0</Virtue>
</Monster>
<Monster>
<ID>2</ID>
<GivenID>2</GivenID>
<MonsterName>고블린</MonsterName>
<Desc>고블린</Desc>
<Damage>2</Damage>
<Life>20</Life>
<MagicPower>1</MagicPower>
<HungryPointPerTurn>1</HungryPointPerTurn>
<ExpForEvolution>100</ExpForEvolution>
<PassiveID>-1</PassiveID>
<Virtue>0</Virtue>
</Monster>
<Monster>
<ID>3</ID>
<GivenID>3</GivenID>
<MonsterName>코볼트</MonsterName>
<Desc>코볼트</Desc>
<Damage>2</Damage>
<Life>20</Life>
<MagicPower>1</MagicPower>
<HungryPointPerTurn>1</HungryPointPerTurn>
<ExpForEvolution>100</ExpForEvolution>
<PassiveID>-1</PassiveID>
<Virtue>0</Virtue>
</Monster>
<Monster>
<ID>4</ID>
<GivenID>4</GivenID>
<MonsterName>슬라임</MonsterName>
<Desc>슬라이무</Desc>
<Damage>1</Damage>
<Life>10</Life>
<MagicPower>1</MagicPower>
<HungryPointPerTurn>0</HungryPointPerTurn>
<ExpForEvolution>100</ExpForEvolution>
<PassiveID>-1</PassiveID>
<Virtue>0</Virtue>
</Monster>
</dataroot>
